Piece_Type,Units,Mass(lbs),Material_Type,Dimensions (LxWxH),Price,Picture
Bar Cabinet,5,109,Dark Brown Oak,18x63x39,288,bar_cabinet.jpeg
Wall-Mount Shelf,12,14,Wall-Mount Bookshelf - Industrial Pipe Style with Wood Veneer Floating Shelves,31x12x23,87,wallmount_shelf.jpeg
Clipboard Shelf,9,8,Wooden Mallet's Ten Pocket Chart Holding Wall File Pockets,48x14x12,101,clipboard_shelf.jpeg
Central Table,11,11," Strong metal frame, this console table with drawers features enhanced stability.",39x11x32,170,central_table.jpeg
Bed,15,180,Solid wood frame and the headboard has foam filling covered in the velvety upholstery,81x43x54,170,darkbrown_bed.jpeg
